date,horse_code,horse_id,horse_name,horse_number,incident,position_final,race_number
2025-10-15,H402,HK_2022_H402,HANDSOME BOMB,12,"After the event A Atzeni stated that he was able to obtain a position with cover in the early stages behind NO OTHER CHOICE with the pace of the event being run inside of standard time.  He said entering the Back Straight approaching the 900 Metres he felt the pace of the event eased and as his mount had a light weight he elected to shift out and ride forward to cross NO OTHER CHOICE.  He said when NO OTHER CHOICE then held its position to his inside for some distance he was obliged to make further use of HANDSOME BOMB to cross that runner.  He further stated that entering the Home Straight HANDSOME BOMB then finished the race off only fairly.  After considering his explanation and taking into account the sectional times of the event which confirmed his evidence that the pace between the 1200 Metres and the 800 Metres had eased, the tactics he adopted were found to be reasonable in the circumstances.  A veterinary inspection immediately following the race did not show any significant findings.  Noted to have lost its right front plate after the race.",7,2
2025-10-15,K135,HK_2024_K135,METAL KING,8,Bumped shortly after the start and became unbalanced.  Near the 950 Metres was steadied to avoid HANDSOME BOMB when racing keenly.,8,2
2025-10-15,J326,HK_2023_J326,PERPETUAL POWER,11,After travelling a short distance was crowded for room between CELTIC TIMES and SAMARKAND which got its head up and shifted out.,9,2
2025-10-15,K049,HK_2024_K049,NO OTHER CHOICE,9,No report.,10,2
2025-10-15,K262,HK_2024_K262,WITHOUT DELAY,4,"A veterinary inspection immediately following the race found that horse to have bled from both nostrils.  Before being allowed to race again, WITHOUT DELAY will be required to perform satisfactorily in a barrier trial and be subjected to an official veterinary examination.",11,2
2025-10-15,K466,HK_2024_K466,MASSIVE FIRE,5,Bumped shortly after the start and became unbalanced.,12,2
2025-10-15,J158,HK_2023_J158,KING MILES,6,Sent for sampling post-race.,1,8
2025-10-15,J364,HK_2023_J364,FANTASTIC FUN,5,Raced keenly in the middle stages.  Sent for sampling post-race.,1,5
2025-10-15,J509,HK_2023_J509,ACE WAR,11,"Became fractious as the start was effected, consequently jumped awkwardly and lost ground.  Held up on the Home Turn.  Sent for sampling post-race.",2,5
2025-10-15,K290,HK_2024_K290,GLORIOUS RYDER,8,No report.,3,5
2025-10-15,G229,HK_2021_G229,FOREVER GLORIOUS,4,No report.,4,5
2025-10-15,K464,HK_2024_K464,YOUNG FIGHTER,9,Held up for clear running approaching the 400 Metres.,5,5
2025-10-15,J152,HK_2023_J152,GALE SAGA,10,Was left racing wide and without cover from the 700 Metres.,6,5
2025-10-15,J213,HK_2023_J213,SMART CITY,6,Over the concluding stages could not be ridden out when racing tight to the inside of YOUNG FIGHTER which shifted in.  After the event M F Poon stated that he was instructed to find cover if circumstances permitted.  He said in the early stages he endeavoured to comply with his instructions but when caught wide and without cover he elected to allow SMART CITY to stride forward to endeavour to obtain a position closer to the rail.  He added that as a result SMART CITY was obliged to race wide and without cover until near the 700 Metres.  A veterinary inspection immediately following the race did not show any significant findings.,7,5
2025-10-15,H358,HK_2022_H358,YOUTH POWER,7,Between the 500 Metres and the 400 Metres was steadied to avoid STAR GLOW when that runner commenced to give ground.  When questioned Apprentice E C W Wong stated that he was instructed to take up a forward position and lead if circumstances permitted.  He said YOUTH POWER jumped only fairly and then he rode his mount along in the early stages to comply with his instructions.  He said when STAR GLOW improved to his outside he was content to allow that horse to cross his mount as he felt a position with cover would be advantageous.,8,5
2025-10-15,J027,HK_2023_J027,STORM RIDER,1,From a wide barrier was shifted across behind runners in the early stages.  Sent for sampling post-race.,2,8
2025-10-15,H235,HK_2022_H235,LUCKY PLANET,9,No report.,3,8
2025-10-15,K092,HK_2024_K092,THE REVOLUTION,12,A veterinary inspection immediately following the race did not show any significant findings.,4,8
2025-10-15,J396,HK_2023_J396,THRIVING BROTHERS,10,No report.,5,8
2025-10-15,K027,HK_2024_K027,JUSTIFYING,11,Bumped on jumping.,6,8
2025-10-15,H321,HK_2022_H321,HAYDAY,4,Bumped on jumping.,7,8
2025-10-15,J320,HK_2023_J320,SUPER INFINITY,3,Jumped only fairly.  After the event B Avdulla could offer no explanation for his mount’s disappointing performance.  A veterinary inspection immediately following the race found that horse to have blood in its mouth.,8,8
2025-10-15,H364,HK_2022_H364,SUPER LEGENDS,7,No report.,9,8
2025-10-15,K407,HK_2024_K407,LUCKY XANDER,8,Jumped awkwardly and lost ground.  After being crossed by SUPER LEGENDS near the 1000 Metres commenced to race keenly and making the turn approaching the 900 Metres was then steadied to avoid SUPER LEGENDS.,10,8
2025-10-15,K356,HK_2024_K356,LOCH TAY,5,From the outside barrier was shifted across behind runners in the early stages.  After the event A Atzeni reported that his mount hung in throughout the event and made contact with the running rail on several occasions.  A veterinary inspection immediately following the race did not show any significant findings.,11,8
2025-10-15,J285,HK_2023_J285,LA FORZA,2,"After the event Z Purton stated that his mount was obliged to race wide and without cover for the majority of the event.  He added that when placed under pressure LA FORZA did not respond to his riding and when he was concerned with the horse’s action he did not ride it out over the final 150 Metres.  A veterinary inspection immediately following the race found that horse to be lame in its left front leg.  The performance of LA FORZA was considered disappointing as compared to its previous race starts.  Before being allowed to race again, LA FORZA will be required to perform to the satisfaction of the Stewards in a barrier trial and be subjected to an official veterinary examination.",12,8
2025-10-15,J529,HK_2023_J529,YIU CHEUNG VICTORY,12,Jumped only fairly.  From a wide barrier was shifted across behind runners in the early stages.  Approaching the 50 Metres was eased and shifted to the inside of YOUTH POWER to continue into clear running.,9,5
2025-10-15,J446,HK_2023_J446,FORTUNATE SON,3,No report.,10,5
2025-10-15,J231,HK_2023_J231,SUNDAY'S SERENADE,1,Bumped on jumping.  From a wide barrier was shifted across behind runners in the early stages.  Approaching the 1300 Metres raced tight to the inside of FORTUNATE SON.  After the event Z Purton stated that after settling towards the back of the field his mount was unable to make up ground in the Home Straight due to the early and middle stages of the event being run outside of standard time.  A veterinary inspection immediately following the race did not show any significant findings.,11,5
2025-10-15,J429,HK_2023_J429,STAR GLOW,2,"Bumped at the start.  After the event C Y Ho stated that from a wide barrier he was given the option of taking up a forward position.  He said when STAR GLOW commenced well and the early stages of the event were run outside of standard time he elected to allow STAR GLOW to stride forward and race outside the lead in the early stages.  He added that STAR GLOW was unable to finish the race off in the Home Straight.  A veterinary inspection immediately following the race found that horse to have sustained small lacerations to the left hind pastern and heel.  The performance of STAR GLOW, which finished tailed out, was considered unacceptable.  Before being allowed to race again, STAR GLOW will be required to perform to the satisfaction of the Stewards in a barrier trial and be subjected to an official veterinary examination.",12,5
2025-10-15,K411,HK_2024_K411,MR DESIRA,5,Bumped on jumping.  Sent for sampling post-race.,1,6
2025-10-15,H110,HK_2022_H110,FIND MY LOVE,1,Shifted in at the start and was bumped.  For a short distance near the 250 Metres had difficulty obtaining clear running when being shifted to the outside of TOURBILLON GOLFER.  Sent for sampling post-race.,2,6
2025-10-15,K320,HK_2024_K320,TOURBILLON GOLFER,3,No report.,3,6
2025-10-15,H379,HK_2022_H379,YEE CHEONG SPIRIT,6,Shifted out at the start and made contact with MR DESIRA.,4,6
2025-10-15,J546,HK_2023_J546,ZETTA FORCE,12,"Near the 900 Metres, when racing keenly, was steadied to avoid LEGENDARY IMPACT which shifted in.",5,6
2025-10-15,K035,HK_2024_K035,LEGENDARY IMPACT,10,No report.,6,6
2025-10-15,K207,HK_2024_K207,STAR PERFORMER,2,Jumped only fairly.,7,6
2025-10-15,K500,HK_2024_K500,GOLDEN FORTUNE,4,Shortly after the start was checked when crowded between RUNJEET and FIND MY LOVE which shifted in despite the efforts of its rider H Bowman.,8,6
2025-10-15,K187,HK_2024_K187,GREAT LEGACY,9,"Shortly after the start raced in restricted room between DR GOLDEN GENERAL and STAR PERFORMER which shifted out slightly.  As a result GREAT LEGACY was eased behind STAR PERFORMER.  Leaving the 900 Metres FIND MY LOVE shifted in and away from RUNJEET.  GREAT LEGACY, which was following and racing ungenerously, got its head up, shifted in and made contact with the running rail.  GREAT LEGACY continued to race ungenerously for some distance thereafter.",9,6
2025-10-15,K276,HK_2024_K276,RUNJEET,11,Bumped on jumping.,10,6
2025-10-15,H380,HK_2022_H380,SPEED DRAGON,8,From the outside barrier was shifted across behind runners in the early stages.  Held up on the Home Turn.  Sent for sampling post-race.,1,7
2025-10-15,H418,HK_2022_H418,CALIFORNIATOTALITY,2,Sent for sampling post-race.,2,7
2025-10-15,G236,HK_2021_G236,ENCOUNTERED,3,"Shortly after the start was bumped and became unbalanced.  Near the 1700 Metres was ridden along to attempt to hold its position between JUMBO LEGEND and CHILL CHIBI, both of which shifted ground slightly.  Passing the 200 Metres the whip of K Teetan was knocked from his grasp by the whip of Apprentice E C W Wong, rider of JUMBO LEGEND.",3,7
2025-10-15,H215,HK_2022_H215,HELENE FEELING,4,No report.,4,7
2025-10-15,G266,HK_2021_G266,JUMBO LEGEND,9,Shortly after the start became unbalanced when bumped with ENCOUNTERED.,5,7
2025-10-15,E461,HK_2020_E461,WINNING DRAGON,10,No report.,6,7
2025-10-15,G371,HK_2021_G371,LA CITY BLANCHE,6,No report.,7,7
2025-10-15,K161,HK_2024_K161,LO RIDER,5,Raced keenly approaching the first turn near the 1300 Metres.  After the event H Bentley stated that the intention was to hold an on-pace position.  He said in the early stages when caught wide and unable to find cover he elected to shift his mount in from a wide barrier to obtain cover which resulted in LO RIDER settling further back than intended.  He added that in the Home Straight LO RIDER finished the race off only fairly from back in the field.  Trainer C Fownes confirmed the intention was to hold a more forward position.  He added in the early stages he was satisfied that Jockey Bentley had obtained a position back in the field as LO RIDER has a tendency to race keenly when ridden along in the early stages.  He said the only explanation he could offer was that LO RIDER was not suited by having to be ridden in this manner in the early stages.  A veterinary inspection immediately following the race did not show any significant findings.  Sent for sampling post-race.,8,7
2025-10-15,D482,HK_2019_D482,TELECOM FIGHTERS,7,A veterinary inspection immediately following the race did not show any significant findings.,9,7
2025-10-15,H109,HK_2022_H109,CHILL CHIBI,1,"Bumped at the start.  After the event H Bowman stated that his mount was obliged to race wide and without cover but failed to respond to his riding from the 500 Metres.  He added when not in a competitive position in the Home Straight he eased his mount down from the event.  A veterinary inspection immediately following the race found that horse to be lame in its left front leg.  The performance of CHILL CHIBI, which finished tailed out, was considered unacceptable.  Before being allowed to race again, CHILL CHIBI will be required to perform to the satisfaction of the Stewards in a barrier trial and be subjected to an official veterinary examination which must include additional diagnostic assessments.",10,7
2025-10-15,K093,HK_2024_K093,EXCELLENCE VALUE,8,Sent for sampling post-race.,1,9
2025-10-15,K226,HK_2024_K226,WROTE A NEW PAGE,6,Leaving the 1600 Metres commenced to race keenly and was steadied to avoid CAMBRIDGE for some distance thereafter.  Sent for sampling post-race.,2,9
2025-10-15,H431,HK_2022_H431,CHARITY GAIN,9,Jumped only fairly.  Held up for clear running on the Home Turn.,3,9
2025-10-15,K156,HK_2024_K156,LIVEANDLETLIVE,7,No report.,4,9
2025-10-15,G476,HK_2021_G476,ROMANTIC LAOS,5,Bumped at the start.,5,9
2025-10-15,K085,HK_2024_K085,CAMBRIDGE,1,Between the 300 Metres and the 200 Metres was held up for clear running.,6,9
2025-10-15,J247,HK_2023_J247,KING GLORIOSO,9,Sent for sampling post-race.,1,4
2025-10-15,K017,HK_2024_K017,THUNDER PRINCE,7,Held up approaching the 200 Metres.  Shifted out at the 200 Metres and made contact with THE PERFECT MATCH.  Sent for sampling post-race.,2,4
2025-10-15,J253,HK_2023_J253,THE PERFECT MATCH,2,"Bumped shortly after the start.  The Stewards considered a protest/objection lodged by C L Chau, rider of THE PERFECT MATCH, 3rd placegetter, against THUNDER PRINCE (H Bowman) being declared 2nd placegetter alleging interference near the 200 Metres.  After considering the evidence the Stewards found that after being held up for clear running behind KING GLORIOSO approaching the 200 Metres THUNDER PRINCE then shifted out and made contact with THE PERFECT MATCH, resulting in that horse being taken out slightly.  As the Stewards could not be comfortably satisfied that had that incident not occurred, THE PERFECT MATCH would have finished in advance of THUNDER PRINCE, the protest/objection was overruled and weighed-in was declared on the numbers semaphored by the Judge.  At a subsequent inquiry H Bowman was advised in similar circumstances he should exercise more care.  In assessing the incident the Stewards took into consideration that Jockey Bowman advised that he had anticipated KING GLORIOSO to continue to shift in which would have presented him with clear running.  When questioned regarding his riding between the 300 Metres and the 200 Metres and as to whether there was an opportunity to ride his mount with more vigour C L Chau stated that he was asked to obtain a position where comfortable but did not place his mount under pressure too soon as THE PERFECT MATCH was found to have bled previously.  He said with these instructions in mind, after entering the Home Straight, whilst encouraging his horse to improve, he did not ride it with full vigour having regard to his instructions and also the fact that THE PERFECT MATCH lay in during that section of the race.  He added that when he reached the 200 Metres he then applied full vigour to his mount and THE PERFECT MATCH finished the race off well following contact with THUNDER PRINCE.  Trainer C S Shum confirmed the instructions and the reasons as to why such instructions were issued and expressed satisfaction with Jockey Chau’s riding.  Having considered the evidence the Stewards found the tactics adopted by Jockey Chau were reasonable in the circumstances.  After the race, an endoscopic examination was conducted on THE PERFECT MATCH at the request of Trainer C S Shum.  The Veterinary Surgeon said this examination showed a substantial amount of blood in the horse’s trachea.  Before being allowed to race again, THE PERFECT MATCH will be subjected to an official veterinary examination.",3,4
2025-10-15,J261,HK_2023_J261,SIGHT HAPPY,6,Briefly held up on the Home Turn.,4,4
2025-10-15,J449,HK_2023_J449,LUCKY KING,10,Jumped awkwardly and lost ground.,5,4
2025-10-15,K106,HK_2024_K106,GOLDEN FRIENDSHIP,12,M L Yeung was reprimanded for using the whip on 2 consecutive strides near the 125 Metres.,6,4
2025-10-15,K486,HK_2024_K486,IMPENDING LEGACY,4,A veterinary inspection immediately following the race did not show any significant findings.,7,4
2025-10-15,K343,HK_2024_K343,INCANTO STAR,8,Jumped only fairly.  Leaving the 150 Metres was disappointed for clear running between SUNNY SING SPIRIT and LUCKY KING which shifted out.,8,4
2025-10-15,K139,HK_2024_K139,UP WITH CHARM,3,Jumped awkwardly.  From the outside barrier was shifted across behind runners in the early stages.  Assistant Trainer W H Ip confirmed that the instructions were to ride the horse in a conservative manner in the early stages to offset the outside barrier.  A veterinary inspection immediately following the race did not show any significant findings.,9,4
2025-10-15,J153,HK_2023_J153,FORTUNE WHISKEY,1,"Jumped awkwardly, shifted out and made contact with GREAT LOOKING.  A veterinary inspection immediately following the race did not show any significant findings.",10,4
2025-10-15,K188,HK_2024_K188,SUNNY SING SPIRIT,11,Bumped shortly after the start.,11,4
2025-10-15,J198,HK_2023_J198,GREAT LOOKING,5,"Bumped at the start.  After travelling a short distance blundered.  The performance of GREAT LOOKING, which finished tailed out on the second consecutive occasion, was considered unacceptable.  Before being allowed to race again, GREAT LOOKING will be required to perform to the satisfaction of the Stewards in consecutive barrier trials and be subjected to an official veterinary examination which must include additional diagnostic assessments.  A veterinary inspection immediately following the race found that horse to be a ""roarer” which had previously been reported.",12,4
2025-10-15,J501,HK_2023_J501,CIRCUIT DUFFY,8,Jumped awkwardly.  Raced wide and without cover for the majority of the event.,11,6
2025-10-15,K412,HK_2024_K412,DR GOLDEN GENERAL,7,Bumped on jumping.  Leaving the 900 Metres shifted in and made contact with the running rail.  Near the 250 Metres lay in and again made contact with the running rail. A veterinary inspection immediately following the race did not show any significant findings.,12,6
2025-10-15,J298,HK_2023_J298,HIGHLAND RAHY,3,No report.,7 DH,9
2025-10-15,K428,HK_2024_K428,WITHALLMYFAITH,11,No report.,7 DH,9
2025-10-15,H383,HK_2022_H383,JOY OF SPRING,2,Jumped awkwardly.   Shortly after the start was crowded between HIGHLAND RAHY and ROMANTIC LAOS.  From a wide barrier was then shifted across behind runners in the early stages.  A veterinary inspection immediately following the race did not show any significant findings. Apprentice E C W Wong was reprimanded for using the whip on 3 consecutive strides near the 250 Metres.,9,9
2025-10-15,G138,HK_2021_G138,S J TOURBILLON,10,Shifted out at the start and was bumped.,10,9
2025-10-15,H192,HK_2022_H192,FLAMINGO TRILLION,4,Raced wide and without cover for the majority of the event.,11,9
2025-10-15,G125,HK_2021_G125,SURE JOYFUL,12,No report.,12,9
2025-10-19,G250,HK_2021_G250,DOUBLE SHOW,14,Sent for sampling post-race.,1,1
2025-10-19,K073,HK_2024_K073,LUCKY BLESSING,7,Sent for sampling post-race.,2,1
2025-10-19,H465,HK_2022_H465,THE CONCENTRATION,11,Badly held up for clear running between the 450 Metres and the 200 Metres.  C L Chau reported that with his mount stepping up in distance and drawing a favourable barrier he was able to hold a more forward position as he had been instructed.,3,1
2025-10-19,H297,HK_2022_H297,RAGNARR,1,Shifted out leaving the 900 Metres and was bumped.  Between the 450 Metres and the 300 Metres was held up for clear running.  Sent for sampling post-race.,4,1
2025-10-19,J264,HK_2023_J264,RUN YES RUN,8,Jumped only fairly.  Approaching the 900 Metres lay in and made contact with CELESTIAL HARMONY.,5,1
2025-10-19,H169,HK_2022_H169,KA YING POWER,13,From the outside barrier was shifted across behind runners in the early stages.  Between the 450 Metres and the 300 Metres was held up for clear running.  After the 300 Metres KA YING POWER then improved into a tight run between GLORIOUS EXPERT and RAGNARR.,6,1
2025-10-19,K059,HK_2024_K059,CELESTIAL HARMONY,2,Jumped only fairly.  Approaching the 900 Metres made contact with the running rail when racing tight to the inside of RUN YES RUN which lay in and away from RAGNARR.,7,1
2025-10-19,G368,HK_2021_G368,VIVA CHALEUR,9,Bumped on jumping. Y L Chung was reprimanded for using the whip on consecutive occasions in 3 consecutive strides after the 200 Metres.,8,1
2025-10-19,K297,HK_2024_K297,PEJIBAYE,8,On jumping was bumped and became unbalanced.  Sent for sampling post-race.,1,6
2025-10-19,K122,HK_2024_K122,EMBLAZON,4,Sent for sampling post-race.,2,6
2025-10-19,J499,HK_2023_J499,GOOD CHAP,10,No report.,3,6
2025-10-19,K400,HK_2024_K400,AEROVOLANIC,2,C Y Ho reported that the instructions were to endeavour to hold a midfield position.  He said when caught wide in the early stages he elected to shift his mount behind runners to take up a position towards the rear of the field to avoid racing wide.,4,6
2025-10-19,K442,HK_2024_K442,PACKING PHOENIX,3,"When questioned Z Purton stated that his mount travelled satisfactorily in the early stages outside the lead.  He said from the 700 Metres his mount came under pressure before giving ground in the Home Straight but he could offer no reason for its disappointing performance.  Trainer K W Lui stated that the horse had pleased him coming into today’s race but could offer no explanation for its performance.  A veterinary inspection immediately following the race did not show any significant findings.  The performance of PACKING PHOENIX, a last start winner, was considered disappointing.  Before being allowed to race again, PACKING PHOENIX will be required to perform to the satisfaction of the Stewards in a barrier trial and be subjected to an official veterinary examination.   Sent for sampling post-race.",5,6
2025-10-19,K099,HK_2024_K099,KING ALLOY,1,R Kingscote stated that the instructions were to go forward but after jumping only fairly his mount settled further back in the field than intended.,6,6
2025-10-19,K487,HK_2024_K487,PROUD BOX,7,Raced very wide and without cover for the majority of the event.,7,6
2025-10-19,K247,HK_2024_K247,KA YING GLORY,6,"Jumped awkwardly, shifted out and was bumped.",8,6
2025-10-19,H483,HK_2022_H483,PATCH OF TIME,11,Jumped only fairly and then shortly after the start was steadied when crowded between GOOD CHAP and SAVVY WARRIOR.  Near the 400 Metres was steadied and shifted to the outside of TOP TO SKY to obtain clear running.,9,6
2025-10-19,K257,HK_2024_K257,SAVVY WARRIOR,5,On jumping was badly crowded between PATCH OF TIME and PEJIBAYE which shifted out after being bumped by KA YING GLORY which jumped awkwardly and shifted out.,10,6
2025-10-19,K339,HK_2024_K339,TOP TO SKY,12,No report.,11,6
2025-10-19,K269,HK_2024_K269,GLORIOUS KINGDOM,9,Jumped only fairly.  Raced wide and without cover for the majority of the event.,12,6
2025-10-19,J520,HK_2023_J520,SPICY STANDARD,,"Withdrawn on 18.10.25 by order of the Stewards acting on veterinary advice (heart irregularity) and replaced by Standby Declared Starter KING ALLOY.  Before being allowed to race again, SPICY STANDARD will be required to perform satisfactorily in a barrier trial and be subjected to an official veterinary examination.",WV,6
2025-10-19,J343,HK_2023_J343,PATCH OF STARS,2,Between the 400 Metres and the 350 Metres was held up for clear running.  Near the 350 Metres shifted out to improve to the outside of COPARTNER FLEET and made contact with SKY JOY.  Sent for sampling post-race.,1,8
2025-10-19,K026,HK_2024_K026,SKY JOY,6,Near the 350 Metres was bumped and taken wider by PATCH OF STARS which shifted out to improve.  Sent for sampling post-race.,2,8
2025-10-19,K369,HK_2024_K369,INFINITE RESOLVE,4,No report.,3,8
2025-10-19,K516,HK_2024_K516,STAR RISE,5,Jumped awkwardly.,4,8
2025-10-19,H203,HK_2022_H203,HEALTHY HEALTHY,12,H Bentley advised that the instructions were to go forward and lead the event.,5,8
2025-10-19,K204,HK_2024_K204,LIGHT YEARS GLORY,11,The tongue tie was replaced at the saddling stalls.,6,8
2025-10-19,J219,HK_2023_J219,CHATEAUNEUF,1,Over the concluding stages could not be fully ridden out when positioned close to HEALTHY HEALTHY.,7,8
2025-10-19,K231,HK_2024_K231,STAR SATYR,9,Jumped only fairly.,8,8
2025-10-19,K342,HK_2024_K342,COPARTNER FLEET,10,K Teetan reported that he had to make some use of his mount to obtain a position outside the lead in the early stages from his outside barrier.  He added whilst COPARTNER FLEET travelled satisfactorily in the middle stages it then failed to respond to his riding when placed under pressure in the Home Straight.  A veterinary inspection immediately following the race did not show any significant findings.,9,8
2025-10-19,K353,HK_2024_K353,WOLF COMING,7,From a wide barrier was shifted across behind runners in the early stages.,10,8
2025-10-19,J437,HK_2023_J437,SAVVY BRILLIANT,3,Raced wide and without cover for the majority of the event.  A veterinary inspection immediately following the race did not show any significant findings.,11,8
2025-10-19,K493,HK_2024_K493,ALL TOO BRAVE,8,"After arriving behind the starting gates was found to have lost its left front plate.  When the horse was unable to be replated it was withdrawn by order of the Stewards.  Before being allowed to race again, ALL TOO BRAVE will be subjected to an official veterinary examination.",WX-A,8
2025-10-19,K114,HK_2024_K114,LUCKY SAM GOR,5,Sent for sampling post-race.,1,5
