date,horse_code,horse_id,horse_name,horse_number,incident,position_final,race_number
2025-11-02,J184,HK_2023_J184,SUPER CHARIZZARD,6,"Shifted out at the start, was bumped on the hindquarters and became unbalanced.  After the 300 Metres was shifted to the outside of MACANESE MASTER to attempt to obtain clear running.  As SUPER CHARIZZARD was being shifted to the outside, MACANESE MASTER (Apprentice P N Wong) commenced to give ground and shifted out slightly, resulting in SUPER CHARIZZARD having to be checked passing the 250 Metres when disappointed for clear running between SONIC BOOM and MACANESE MASTER.  As a consequence SUPER CHARIZZARD was held up between the 250 Metres and the 100 Metres.  Apprentice Wong was advised to exercise more care.",9,1
2025-11-02,J535,HK_2023_J535,HE WAS ME,8,"Jumped only fairly and shortly after the start was steadied when crowded between COLONEL and SUPER CHARIZZARD which shifted out and away from SUPER ELITE.  Lay in throughout the event.  M L Yeung stated that his mount failed to travel during the race and, in his opinion, is better suited racing at Sha Tin.  A veterinary inspection immediately following the race did not show any significant findings.",10,1
2025-11-02,J532,HK_2023_J532,MACANESE MASTER,12,"When questioned Apprentice P N Wong stated that her instructions from the outside barrier were to lead the event.  She said on jumping MACANESE MASTER jumped awkwardly, shifted out and as a result lost some ground.  She said having regard to her instructions she elected to ride MACANESE MASTER forward to attempt to cross runners to her inside but when unable to do so MACANESE MASTER was obliged to race wide and without cover for the majority of the event.  When questioned if there was an opportunity to ride MACANESE MASTER in a conservative manner in the early stages, given the horse had jumped awkwardly, Apprentice Wong stated that when she thought that it was still possible to comply with her instructions as she was of the opinion a number of runners to her inside were not being ridden forward, she elected to ride her mount forward to comply with the instructions.  Trainer Y S Tsui confirmed the instructions issued.",11,1
2025-11-02,J171,HK_2023_J171,SUNNY DARLING,5,"Was examined by the Veterinary Officer on arrival at the Start and found to be lame in its left front leg.  Acting on veterinary advice that SUNNY DARLING was not suitable to race, the horse was withdrawn by order of the Stewards.  Before being allowed to race again, SUNNY DARLING will be subjected to an official veterinary examination which must include additional diagnostic assessments.",WV-A,1
2025-10-30,K094,HK_2024_K094,NEW FOREST,12,Sent for sampling post-race.,1,8
2025-10-30,J330,HK_2023_J330,MOJAVE DESERT,4,Bumped on jumping.  From a wide barrier was shifted across behind runners in the early stages.  In the early stages raced keenly.  Sent for sampling post-race.,2,8
2025-10-30,G223,HK_2021_G223,ARIEL,8,"Near the 400 Metres the left stirrup used by Apprentice E C W Wong broke, resulting in Apprentice Wong completing the remainder of the race without the use of his left stirrup.  After inspecting his stirrups, in the presence of the Chief Riding Instructor, Mr F Coetzee, he was advised he should ensure that at all times he maintains his gear in good working condition.",3,8
2025-10-30,H165,HK_2022_H165,TURIN MASCOT,7,A veterinary inspection immediately following the race did not show any significant findings.,4,8
2025-10-30,G392,HK_2021_G392,KARMA,1,No report.,5,8
2025-10-30,J536,HK_2023_J536,NOISY BOY,2,Shortly after the start was crowded between TOURBILLON PRINCE and CHILL KAKA which shifted out.,6,8
2025-10-30,H016,HK_2021_H016,PRECISION GOAL,14,No report.,7,8
2025-10-30,H122,HK_2022_H122,TOURBILLON PRINCE,3,"Apprentice P N Wong (PRECISION GOAL) was reprimanded for permitting her mount to shift in after the winning post, resulting in TOURBILLON PRINCE having to be checked.",8,8
2025-10-30,J486,HK_2023_J486,CHILL KAKA,9,Shifted out at the start and was bumped.  Raced wide and without cover for the majority of the event.,9,8
2025-10-30,J239,HK_2023_J239,MR ENERGIA,5,Blundered on jumping. A veterinary inspection immediately following the race found that horse to have sustained a laceration to the left hind leg.  Sent for sampling post-race.,10,8
2025-10-30,J291,HK_2023_J291,YOUNG ACHIEVER,6,Bumped on jumping.  From a wide barrier was shifted across behind runners in the early stages.,11,8
2025-10-30,J266,HK_2023_J266,HARMONY GALAXY,11,In the middle stages lay in and away from NEVER PETER OUT and made contact with the running rail near the 800 Metres.,12,8
2025-10-30,J200,HK_2023_J200,NEVER PETER OUT,10,A veterinary inspection immediately following the race did not show any significant findings.,13,8
2025-11-02,H317,HK_2022_H317,DAN ATTACK,12,When questioned regarding the horse leading H Bentley stated that his instructions were to settle the horse where comfortable but had not anticipated leading the event.  He said after DAN ATTACK jumped well and was caught very wide in the early stages he elected to allow the horse to stride forward and lead to avoid covering additional ground.  Sent for sampling post-race.,1,2
2025-11-02,K112,HK_2024_K112,QUICK CONTRIBUTION,9,Jumped only fairly and shortly after the start was steadied when crowded between JUICY DRAGON and ALL’S WELL which shifted out slightly. K Teetan was severely reprimanded for using the whip on consecutive occasions in 4 consecutive strides near the 250 Metres. Sent for sampling post-race.,2,2
2025-11-02,K051,HK_2024_K051,SONIC PURSUIT,10,Jumped awkwardly.,3,2
2025-11-02,G471,HK_2021_G471,DENFIELD,3,"Jumped only fairly.  Approaching the 150 Metres had difficulty obtaining clear running when being shifted to the outside of JUICY DRAGON.  After the race an endoscopic examination was conducted on DENFIELD at the request of Trainer C S Shum.  The Veterinary Surgeon said this examination showed a substantial amount of blood in the horse’s trachea.  Before being allowed to race again, DENFIELD will be subjected to an official veterinary examination.",4,2
2025-11-02,K136,HK_2024_K136,WITH A SMILE,1,Shifted in at the start and was bumped.  Was left racing wide and without cover from the 700 Metres.,5,2
2025-11-02,J487,HK_2023_J487,MEOWTH,4,Despite being ridden along in the early stages failed to show sufficient pace to hold a more forward position.,6,2
2025-11-02,K434,HK_2024_K434,AMAZING KID,8,No report.,7,2
2025-11-02,H319,HK_2022_H319,SECOND TO NONE,7,Bumped on jumping.,8,2
2025-11-02,K294,HK_2024_K294,ALL'S WELL,2,Near the 900 Metres was steadied when crowded for room by JUICY DRAGON which shifted in and away from DAN ATTACK despite the efforts of its rider Apprentice P N Wong. As the Stewards were satisfied that Apprentice Wong had endeavoured to correct her mount in this incident no action was taken.  Near the 150 Metres was steadied when crowded between WITH A SMILE and DENFIELD (H Bowman) which shifted to the outside of JUICY DRAGON to obtain clear running.  H Bowman was reprimanded and advised to exercise more care in similar circumstances.  M Chadwick reported that after being crowded near the 900 Metres his mount finished the race off only fairly in the Home Straight.  A veterinary inspection immediately following the race did not show any significant findings.  Sent for sampling post-race.,9,2
2025-11-02,K405,HK_2024_K405,JUICY DRAGON,6,Bumped at the start.  Near the 1100 Metres made contact with WITH A SMILE when WITH A SMILE was racing tight to the inside of SONIC PURSUIT and when ALL’S WELL shifted out slightly.  A veterinary inspection immediately following the race did not show any significant findings.,10,2
2025-10-30,K535,HK_2024_K535,TALENTS TRUMP,13,"Jumped only fairly.  D Probert reported that his mount, which was having its first race start in Hong Kong, raced greenly throughout the event and in the early stages was steadied away from HARMONY GALAXY when racing keenly.  A veterinary inspection immediately following the race did not show any significant findings.",14,8
2025-11-02,K322,HK_2024_K322,ARGENTO OCEAN,4,"H Bowman stated that whilst he was asked to endeavour to hold a forward position, when his mount jumped well today, he elected to take advantage of the good start to cross in the early stages which resulted in ARGENTO OCEAN holding a more forward position than expected.  H Bowman was reprimanded for using the whip on consecutive occasions in 2 consecutive strides near the 150 Metres. Sent for sampling post-race.",1,5
2025-11-02,K064,HK_2024_K064,LUCKY MCQUEEN,10,M Chadwick reported that his instructions were to hold an on-pace position.  He said when LUCKY MCQUEEN jumped only fairly and then raced greenly during the race it settled further back in the field than what had been intended.  Sent for sampling post-race.,2,5
2025-11-02,K325,HK_2024_K325,BROWNNEEDSFURTHER,5,No report.,3,5
2025-11-02,K150,HK_2024_K150,AUTUMN VIBES,7,A veterinary inspection immediately following the race did not show any significant findings.,4,5
2025-11-02,J480,HK_2023_J480,EXCEED THE WISH,8,Shortly after the start was steadied to avoid ARGENTO OCEAN which shifted out slightly.  From a wide barrier was then shifted across behind runners in the early stages.  Near the 300 Metres shifted out when improving into a tight run between SIGHT DREAMER and BROWNNEEDSFURTHER.,5,5
2025-11-02,K264,HK_2024_K264,EVERSTAR,1,No report.,6,5
2025-11-02,K406,HK_2024_K406,WIN METHOD,12,From the outside barrier was shifted across behind runners in the early stages.,7,5
2025-11-02,H230,HK_2022_H230,WINNING DATA,3,Approaching the 500 Metres shifted out when being steadied to avoid SIGHT DREAMER.,8,5
2025-11-02,J542,HK_2023_J542,SIGHT DREAMER,9,Making the Home Turn was taken wider by EXCEED THE WISH which shifted out.  Bumped near the 300 Metres.  Raced wide and without cover for the majority of the event.,9,5
2025-11-02,K349,HK_2024_K349,SUPER PACE,2,No report.,10,5
2025-11-02,K244,HK_2024_K244,SMART ENGINEER,11,"Near the 100 Metres shifted out, resulting in its rider D Probert having to stop riding and straighten his mount.  A veterinary inspection immediately following the race did not show any significant findings.",11,5
2025-11-02,K422,HK_2024_K422,WINNING CIGAR,6,Slow to begin.,12,5
2025-11-02,J423,HK_2023_J423,DAY DAY VICTORY,11,Leaving the 500 Metres was steadied away from STAR PERFORMER when taken out slightly by HEALTHY HEALTHY.  Sent for sampling post-race.,1,4
2025-11-02,H203,HK_2022_H203,HEALTHY HEALTHY,1,Near the 350 Metres was shifted out to improve and made contact with STAR PERFORMER.  Sent for sampling post-race.,2,4
2025-11-02,K411,HK_2024_K411,MR DESIRA,4,"When placed under pressure in the Home Straight lay in, resulting in its rider C Y Ho changing his whip through to his right hand near the 200 Metres.  Sent for sampling post-race.",3,4
2025-11-02,E175,HK_2020_E175,HARMONY FIRE,5,L Ferraris reported that when his mount jumped only fairly it settled further back in the field than what he had intended.,4,4
2025-11-02,K207,HK_2024_K207,STAR PERFORMER,6,Near the 350 Metres was bumped by HEALTHY HEALTHY when that runner shifted out to improve.  Raced wide and without cover for the majority of the event.  D Probert reported that he was instructed to endeavour to hold an on-pace position.,5,4
2025-11-02,G394,HK_2021_G394,HEROIC MASTER,8,From the outside barrier was shifted across behind runners in the early stages.  Near the 500 Metres commenced to race keenly and was then checked to avoid CIRCUIT HAPPY when that runner was steadied away from DAY DAY VICTORY.  Held up making the Home Turn when being steadied away from DAY DAY VICTORY.,6,4
2025-11-02,H476,HK_2022_H476,PATCH OF WATCH,12,Jumped awkwardly and lost ground.  Over the concluding stages could not be ridden out when held up behind MR DESIRA.,7,4
2025-11-02,J087,HK_2023_J087,SPICY SPANGLE,10,Near the 200 Metres was shifted to the outside of MR DESIRA to continue into clear running.,8,4
2025-11-02,H134,HK_2022_H134,LEAN MASTER,3,"Jumped awkwardly, shifted out and made contact with LUCKY TWENTY, resulting in LEAN MASTER becoming unbalanced.  Apprentice P N Wong stated that after jumping awkwardly her mount settled further back in the field than what had been intended.  A veterinary inspection immediately following the race did not show any significant findings.",9,4
2025-11-02,E432,HK_2020_E432,SERGEANT PEPPER,9,Raced very wide and without cover for the majority of the event.,10,4
2025-11-02,K482,HK_2024_K482,CIRCUIT HAPPY,7,Leaving the 500 Metres was steadied to avoid DAY DAY VICTORY.,11,4
2025-11-02,K392,HK_2024_K392,LUCKY TWENTY,2,"On jumping was crowded between DAY DAY VICTORY and LEAN MASTER which shifted out, resulting in LUCKY TWENTY becoming unbalanced.  J Orman reported that he was able to take up an on-pace position as he had been instructed.  He said in the Home Straight his mount did not respond to his riding and the only explanation he could offer was that when the horse won its first race start on 9 July 2025 it was advantaged by being able to obtain a position on the running rail.  A veterinary inspection immediately following the race did not show any significant findings.",12,4
2025-10-30,E471,HK_2020_E471,LESLIE,13,Sent for sampling post-race.,1,6
2025-10-30,J093,HK_2023_J093,SHANGHAI STYLE,4,Raced wide and without cover for the majority of the event.  Sent for sampling post-race. H Bowman was reprimanded for using the whip on 2 consecutive strides near the 150 Metres.,2,6
2025-10-30,H358,HK_2022_H358,YOUTH POWER,11,No report.,3,6
2025-10-30,J137,HK_2023_J137,GLORIOUS JOURNEY,7,On jumping was crowded by YODA’S CHOICE which shifted in.  Over the concluding stages could not be ridden out when crowded to the inside of LESLIE (M F Poon) which shifted in.  M F Poon was advised to exercise more care.  Prior to declaring weighed-in C Y Ho viewed the patrol films to ascertain if there were sufficient grounds to lodge a protest/objection.  When he was satisfied there were not sufficient grounds he declined to lodge a protest/objection and weighed-in was declared on the numbers semaphored by the Judge.,4,6
2025-10-30,J123,HK_2023_J123,CALIFORNIA STAR,8,Slow to begin.,5,6
2025-10-30,J146,HK_2023_J146,YODA'S CHOICE,12,Shifted in at the start and was bumped.  L Ferraris stated that he was obliged to make too much use of his mount in the early stages to lead and as a consequence YODA’S CHOICE finished the race off only fairly in the Home Straight.  A veterinary inspection immediately following the race did not show any significant findings.  Sent for sampling post-race.,6,6
2025-10-30,H234,HK_2022_H234,MEEPMEEP,14,No report.,7,6
2025-10-30,J080,HK_2023_J080,FASHION LEGEND,6,No report.,8,6
2025-10-30,E494,HK_2020_E494,CHARMING STEED,5,No report.,9,6
2025-10-30,J398,HK_2023_J398,LUCK IS BACK,1,No report.,10,6
2025-10-30,K358,HK_2024_K358,SEA CHARIOT,3,C L Chau reported that his instructions from a wide barrier were to endeavour to find cover.  He said as a consequence his mount settled further back in the field than its previous race starts so as to comply with his instructions.  A veterinary inspection immediately following the race did not show any significant findings.,11,6
2025-11-02,H349,HK_2022_H349,GOOD FORTUNE,5,"Blundered on jumping, shifted out and made contact with SECOND TO NONE.  Leaving the 800 Metres became unbalanced when being corrected by its rider L Ferraris when it shifted in towards WITH A SMILE.  L Ferraris stated that his instructions were to go forward.  He said when he was unable to cross runners to his inside in the early stages his mount was obliged to race very wide and without cover before giving ground in the Home Straight.  A veterinary inspection immediately following the race revealed that the horse was displaying an irregular heart rhythm and also found the horse to have a substantial amount of blood in its trachea.  Before being allowed to race again, GOOD FORTUNE will be required to perform satisfactorily in a barrier trial and be subjected to an official veterinary examination.",11,2
2025-11-02,K025,HK_2024_K025,SNOWTHORN,11,"On exiting the Parade Ring R Kingscote was dislodged, resulting in SNOWTHORN galloping a considerable distance before being recaptured.  Acting on veterinary advice that SNOWTHORN was not suitable to race the horse was withdrawn by order of the Stewards.  Before being allowed to race again, SNOWTHORN will be subjected to an official veterinary examination.",WV-A,2
2025-11-02,J290,HK_2023_J290,FLYING WROTE,,"Withdrawn on 31.10.25 by order of the Stewards acting on veterinary advice (heart irregularity) and replaced by Standby Declared Starter SUPER PACE.  Before being allowed to race again, FLYING WROTE will be required to perform satisfactorily in a barrier trial and be subjected to an official veterinary examination.",WV,5
2025-10-30,K009,HK_2024_K009,PRESTIGE RICKY,2,"R Kingscote reported that his mount was fractious in the barriers and when being assisted by the starting gate handler its bridle shifted, resulting in it becoming unsecured.  He said as a result in the early stages he was obliged to reach forward to reposition the bridle to its correct position.  A veterinary inspection immediately following the race did not show any significant findings.",12,6
2025-10-30,K230,HK_2024_K230,SPEEDY TRIDENT,10,Approaching the 1500 Metres was briefly tightened by SHANGHAI STYLE which lay in and away from FASHION LEGEND.,13,6
2025-10-30,J411,HK_2023_J411,MAGIC COSMOS,9,"The performance of MAGIC COSMOS, which finished tailed out, was considered unacceptable.  Before being allowed to race again, MAGIC COSMOS will be required to perform to the satisfaction of the Stewards in a barrier trial and be subjected to an official veterinary examination.   A veterinary inspection immediately following the race did not show any significant findings.",14,6
2025-11-02,E061,HK_2020_E061,HARMONY N BLESSED,1,Sent for sampling post-race.,1,7
2025-11-02,K010,HK_2024_K010,ETERNAL FORTUNE,2,Shifted out at the start and was bumped.  Sent for sampling post-race.,2,7
2025-11-02,K548,HK_2024_K548,QUARTZ LEGEND,5,Jumped only fairly.,3,7
2025-11-02,K407,HK_2024_K407,LUCKY XANDER,8,Jumped awkwardly.  Shortly after the start became unbalanced when bumped by ETERNAL FORTUNE which shifted out.  K Teetan reported that his mount raced greenly during the event and proved difficult to ride out in the Home Straight.,4,7
2025-11-02,J468,HK_2023_J468,CANDLELIGHT DINNER,6,No report.,5,7
2025-11-02,K468,HK_2024_K468,BLUE ILLUSION,7,No report.,6,7
2025-11-02,K361,HK_2024_K361,SIR CHARGE,12,Jumped only fairly.  Shortly after the start was then checked when crowded between PARENTS’ LOVE and LUCKY XANDER which was taken out by ETERNAL FORTUNE.  Raced wide and without cover for the majority of the event.,7,7
2025-11-02,H405,HK_2022_H405,PARENTS' LOVE,3,"Y L Chung stated that his mount performs best when able to be positioned on the rail and this, in his opinion, was the reason why the horse did not finish the race off in the Home Straight.  A veterinary inspection immediately following the race did not show any significant findings.",8,7
2025-11-02,K513,HK_2024_K513,SIX THREE WIN,4,"Jumped awkwardly.  Near the 200 Metres lay in, resulting in its rider L Hewitson having to stop riding and changing his whip through to his right hand.",9,7
2025-11-02,H197,HK_2022_H197,TACTICAL COMMAND,11,Between the 200 Metres and the 100 Metres had difficulty obtaining clear running when positioned behind BLUE ILLUSION.  When being shifted to the inside of BLUE ILLUSION leaving the 100 Metres was then unable to be ridden out to the finish of the race when held up behind PARENTS’ LOVE which was giving ground.,10,7
2025-11-02,J393,HK_2023_J393,VICTOR THE RAPID,9,Jumped only fairly.  A veterinary inspection immediately following the race did not show any significant findings.,11,7
2025-11-02,K315,HK_2024_K315,LOOKING BRIGHT,10,"A veterinary inspection immediately following the race found that horse to have bled from both nostrils.  Before being allowed to race again, LOOKING BRIGHT will be required to perform satisfactorily in a barrier trial and be subjected to an official veterinary examination.  Sent for sampling post-race.",12,7
2025-11-02,J105,HK_2023_J105,HAKKA RADIANCE,10,Sent for sampling post-race.,1,6
2025-11-02,J183,HK_2023_J183,FIREFOOT,9,Sent for sampling post-race.,2,6
2025-11-02,J502,HK_2023_J502,OCEAN IMPACT,6,No report.,3,6
2025-11-02,E496,HK_2021_E496,MANAGEMENT FOLKS,5,Slow to begin.,4,6
2025-11-02,J377,HK_2023_J377,MISSION STRIKE,7,Bumped at the start.,5,6
2025-11-02,K151,HK_2024_K151,CELESTIAL PATCH,11,No report.,6,6
2025-11-02,H486,HK_2022_H486,KINGLY DEMEANOR,4,No report.,7,6
2025-11-02,H087,HK_2022_H087,CAN'T GO WONG,3,No report.,8,6
2025-11-02,J538,HK_2023_J538,SMART TRIO,12,No report.,9,6
2025-11-02,J331,HK_2023_J331,PERFECT PAIRING,8,Jumped only fairly and then was bumped at the start.,10,6
2025-11-02,G229,HK_2021_G229,FOREVER GLORIOUS,2,"K De Melo could offer no excuse for his mount’s failure to run on in the Home Straight.  Trainer B Crawford stated that, in his opinion, the horse was not suited by the ""Good to Firm” track conditions.  A veterinary inspection immediately following the race did not show any significant findings.",11,6
2025-11-02,H429,HK_2022_H429,FRANTANCK,1,"Jumped awkwardly.  Apprentice P N Wong stated that shortly after the start her saddle shifted back, placing her at some disadvantage throughout the event.  A veterinary inspection immediately following the race did not show any significant findings.",12,6
2025-11-02,J364,HK_2023_J364,FANTASTIC FUN,4,Sent for sampling post-race.,1,3
2025-11-02,H070,HK_2022_H070,SAMARKAND,3,Jumped awkwardly.  Sent for sampling post-race.,2,3
2025-11-02,G292,HK_2021_G292,OUR LUCKY GLORY,8,On jumping was crowded between MATSU VICTOR and THE AZURE which shifted out.  Near the 550 Metres was steadied when momentarily crowded by FANTASTIC FUN which shifted in before being corrected by its rider H Bowman.,3,3
2025-11-02,J236,HK_2023_J236,AMAZING AWARD,5,Bumped shortly after the start.  K Teetan reported that he was given the option of holding a more forward position and when his mount jumped well he elected to capitalise on the good start to hold an on-pace position.,4,3
2025-11-02,J227,HK_2023_J227,THE AZURE,2,"Shifted out at the start, was bumped and became unbalanced.  Held up making the Home Turn.  Approaching the 150 Metres had some difficulty obtaining clear running when being shifted to the inside of STERLING WONGCHOY.",5,3
2025-11-02,G095,HK_2021_G095,SETANTA,7,No report.,6,3
2025-11-02,H472,HK_2022_H472,MATSU VICTOR,6,Bumped on jumping and became unbalanced.  From the 150 Metres raced tight to the inside of THE AZURE.  Near the 50 Metres MATSU VICTOR was then checked when crowded between THE AZURE and OUR LUCKY GLORY (A Badel) which shifted out before being corrected by its rider.  A Badel was severely reprimanded and advised  that in similar circumstances he must ensure there is sufficient racing room for him to improve into.  A veterinary inspection immediately following the race did not show any significant findings.,7,3
2025-11-02,H273,HK_2022_H273,STERLING WONGCHOY,12,Shortly after the start shifted out and bumped AMAZING AWARD.  R Kingscote reported that his mount travelled comfortably outside the leader SAMARKAND but did not respond strongly to his riding in the Home Straight.  A veterinary inspection immediately following the race did not show any significant findings.  Sent for sampling post-race.,8,3
2025-11-02,H237,HK_2022_H237,SIMPLE HEDGE,10,Jumped only fairly.,9,3
2025-11-02,K194,HK_2024_K194,BIG STRIDE,9,No report.,10,3
2025-11-02,H111,HK_2022_H111,THESIS,1,A veterinary inspection immediately following the race did not show any significant findings.,11,3
2025-11-02,J371,HK_2023_J371,SMILING EMPEROR,11,Shortly after the start was crowded between SETANTA and FANTASTIC FUN which shifted in slightly.  H Bentley reported that the instructions were to hold a more forward position but not to make use of the horse early as it has a tendency to race keenly.  He said when unable to hold a more forward position he elected to come back and settle towards the back of the field so that his mount was not obliged to cover additional ground.  A veterinary inspection immediately following the race did not show any significant findings.,12,3
2025-11-05,D241,HK_2019_D241,SUPER HONG KONG,7,"K Teetan was fined $5,000 for using his whip in a manner where the hand holding the whip was above shoulder height on two occasions in the Home Straight.  Sent for sampling post-race.",1,1
2025-11-05,J452,HK_2023_J452,STORM RUNNER,1,Sent for sampling post-race.,2,1
2025-11-05,J326,HK_2023_J326,PERPETUAL POWER,3,No report.,3,1
2025-11-05,H168,HK_2022_H168,ROMANTIC FANTASY,2,Shifted out shortly after the start and was bumped.,4,1
2025-11-05,H034,HK_2022_H034,LEATHER MASTER,5,No report.,5,1
2025-11-05,J193,HK_2023_J193,WAH MAY WAI WAI,4,Noted to have blood in the mouth on arrival at the Start.  Was examined by the Veterinary Officer and passed suitable to race.  Raced keenly in the early stages.  Y L Chung reported that his instructions were to lead the event.  He said his mount jumped awkwardly and as a result was slow to begin and was then hampered by MR ALADDIN which was taken out.  He added as a consequence WAH MAY WAI WAI settled further back in the field than intended.  A veterinary inspection immediately following the race did not show any significant findings.,6,1
